cmorl_cyborg/outputs/archive/2026-04-21_second_phase/paper_appendix/critical_safe_v2_2_4obj_analysis/audit_shortlist/seed_0011/audit_shortlist__stage2_ext_013_obj_2_semantic_audit_replay20/env_run_risk_table.csv

method_name,seed,policy_id,candidate_label,episode_id,env_idx,env_seed,step_count,security_return,business_return,cost_return,critical_host_safety_return,business_violation_flag,cost_violation_flag,env_run_feasible_flag,enterprise_foothold_step,first_critical_hit_step,ever_critical_breach,final_critical_breach,critical_dwell_steps,op_server0_impact_count,max_compromised_host_count,blue_first_relevant_response_step,response_delay_after_enterprise,response_delay_after_critical,shield_active_step_count,shield_active_step_rate,shield_fallback_step_count,shield_fallback_step_rate,mean_shield_blocked_probability_mass,no_post_critical_response,risk_tier
ours_stage2_fair_critical_safe_v2_2_4obj,11,stage2_ext_013_obj_2,audit_shortlist,episode_000,0,11,100,-170.59999424219131,-27.77499943971634,-18.80000028014183,0.0,False,False,True,5,,False,False,0,0,3,6,1,,47,0.47,0,0.0,0.4699979829788208,False,Tier 1 Near-Miss
ours_stage2_fair_critical_safe_v2_2_4obj,11,stage2_ext_013_obj_2,audit_shortlist,episode_000,1,1011,100,-170.59999424219131,-27.77499943971634,-18.80000028014183,0.0,False,False,True,5,,False,False,0,0,3,6,1,,47,0.47,0,0.0,0.4699979829788208,False,Tier 1 Near-Miss
ours_stage2_fair_critical_safe_v2_2_4obj,11,stage2_ext_013_obj_2,audit_shortlist,episode_000,2,2011,100,-170.59999424219131,-27.77499943971634,-18.80000028014183,0.0,False,False,True,5,,False,False,0,0,3,6,1,,47,0.47,0,0.0,0.46999809503555295,False,Tier 1 Near-Miss
ours_stage2_fair_critical_safe_v2_2_4obj,11,stage2_ext_013_obj_2,audit_shortlist,episode_000,3,3011,100,-170.59999424219131,-27.77499943971634,-18.80000028014183,0.0,False,False,True,5,,False,False,0,0,3,6,1,,47,0.47,0,0.0,0.46999809503555295,False,Tier 1 Near-Miss
ours_stage2_fair_critical_safe_v2_2_4obj,11,stage2_ext_013_obj_2,audit_shortlist,episode_000,4,4011,100,-170.59999424219131,-27.77499943971634,-18.80000028014183,0.0,False,False,True,5,,False,False,0,0,3,6,1,,47,0.47,0,0.0,0.46999809503555295,False,Tier 1 Near-Miss
ours_stage2_fair_critical_safe_v2_2_4obj,11,stage2_ext_013_obj_2,audit_shortlist,episode_000,5,5011,100,-170.59999424219131,-27.77499943971634,-18.80000028014183,0.0,False,False,True,5,,False,False,0,0,3,6,1,,47,0.47,0,0.0,0.46999809503555295,False,Tier 1 Near-Miss
ours_stage2_fair_critical_safe_v2_2_4obj,11,stage2_ext_013_obj_2,audit_shortlist,episode_000,6,6011,100,-170.59999424219131,-27.77499943971634,-18.80000028014183,0.0,False,False,True,5,,False,False,0,0,3,6,1,,47,0.47,0,0.0,0.46999809503555295,False,Tier 1 Near-Miss
ours_stage2_fair_critical_safe_v2_2_4obj,11,stage2_ext_013_obj_2,audit_shortlist,episode_000,7,7011,100,-170.59999424219131,-27.77499943971634,-18.80000028014183,0.0,False,False,True,5,,False,False,0,0,3,6,1,,47,0.47,0,0.0,0.4699979829788208,False,Tier 1 Near-Miss
ours_stage2_fair_critical_safe_v2_2_4obj,11,stage2_ext_013_obj_2,audit_shortlist,episode_001,0,12,100,-170.59999424219131,-27.77499943971634,-18.80000028014183,0.0,False,False,True,5,,False,False,0,0,3,6,1,,47,0.47,0,0.0,0.46999809503555295,False,Tier 1 Near-Miss
ours_stage2_fair_critical_safe_v2_2_4obj,11,stage2_ext_013_obj_2,audit_shortlist,episode_001,1,1012,100,-170.59999424219131,-27.77499943971634,-18.80000028014183,0.0,False,False,True,5,,False,False,0,0,3,6,1,,47,0.47,0,0.0,0.46999809503555295,False,Tier 1 Near-Miss
ours_stage2_fair_critical_safe_v2_2_4obj,11,stage2_ext_013_obj_2,audit_shortlist,episode_001,2,2012,100,-170.59999424219131,-27.77499943971634,-18.80000028014183,0.0,False,False,True,5,,False,False,0,0,3,6,1,,47,0.47,0,0.0,0.4699979829788208,False,Tier 1 Near-Miss
ours_stage2_fair_critical_safe_v2_2_4obj,11,stage2_ext_013_obj_2,audit_shortlist,episode_001,3,3012,100,-170.59999424219131,-27.77499943971634,-18.80000028014183,0.0,False,False,True,5,,False,False,0,0,3,6,1,,47,0.47,0,0.0,0.4699979829788208,False,Tier 1 Near-Miss
ours_stage2_fair_critical_safe_v2_2_4obj,11,stage2_ext_013_obj_2,audit_shortlist,episode_001,4,4012,100,-170.59999424219131,-27.77499943971634,-18.80000028014183,0.0,False,False,True,5,,False,False,0,0,3,6,1,,47,0.47,0,0.0,0.4699979829788208,False,Tier 1 Near-Miss
ours_stage2_fair_critical_safe_v2_2_4obj,11,stage2_ext_013_obj_2,audit_shortlist,episode_001,5,5012,100,-170.59999424219131,-27.77499943971634,-18.80000028014183,0.0,False,False,True,5,,False,False,0,0,3,6,1,,47,0.47,0,0.0,0.4699979829788208,False,Tier 1 Near-Miss
ours_stage2_fair_critical_safe_v2_2_4obj,11,stage2_ext_013_obj_2,audit_shortlist,episode_001,6,6012,100,-170.59999424219131,-27.77499943971634,-18.80000028014183,0.0,False,False,True,5,,False,False,0,0,3,6,1,,47,0.47,0,0.0,0.4699979829788208,False,Tier 1 Near-Miss
ours_stage2_fair_critical_safe_v2_2_4obj,11,stage2_ext_013_obj_2,audit_shortlist,episode_001,7,7012,100,-170.59999424219131,-27.77499943971634,-18.80000028014183,0.0,False,False,True,5,,False,False,0,0,3,6,1,,47,0.47,0,0.0,0.46999809503555295,False,Tier 1 Near-Miss
ours_stage2_fair_critical_safe_v2_2_4obj,11,stage2_ext_013_obj_2,audit_shortlist,episode_002,0,13,100,-170.59999424219131,-27.77499943971634,-18.80000028014183,0.0,False,False,True,5,,False,False,0,0,3,6,1,,47,0.47,0,0.0,0.4699979829788208,False,Tier 1 Near-Miss
ours_stage2_fair_critical_safe_v2_2_4obj,11,stage2_ext_013_obj_2,audit_shortlist,episode_002,1,1013,100,-170.59999424219131,-27.77499943971634,-18.80000028014183,0.0,False,False,True,5,,False,False,0,0,3,6,1,,47,0.47,0,0.0,0.46999809503555295,False,Tier 1 Near-Miss
ours_stage2_fair_critical_safe_v2_2_4obj,11,stage2_ext_013_obj_2,audit_shortlist,episode_002,2,2013,100,-170.59999424219131,-27.77499943971634,-18.80000028014183,0.0,False,False,True,5,,False,False,0,0,3,6,1,,47,0.47,0,0.0,0.4699979829788208,False,Tier 1 Near-Miss
ours_stage2_fair_critical_safe_v2_2_4obj,11,stage2_ext_013_obj_2,audit_shortlist,episode_002,3,3013,100,-170.59999424219131,-27.77499943971634,-18.80000028014183,0.0,False,False,True,5,,False,False,0,0,3,6,1,,47,0.47,0,0.0,0.4699979829788208,False,Tier 1 Near-Miss
ours_stage2_fair_critical_safe_v2_2_4obj,11,stage2_ext_013_obj_2,audit_shortlist,episode_002,4,4013,100,-170.59999424219131,-27.77499943971634,-18.80000028014183,0.0,False,False,True,5,,False,False,0,0,3,6,1,,47,0.47,0,0.0,0.4699979829788208,False,Tier 1 Near-Miss
ours_stage2_fair_critical_safe_v2_2_4obj,11,stage2_ext_013_obj_2,audit_shortlist,episode_002,5,5013,100,-170.59999424219131,-27.77499943971634,-18.80000028014183,0.0,False,False,True,5,,False,False,0,0,3,6,1,,47,0.47,0,0.0,0.4699979829788208,False,Tier 1 Near-Miss
ours_stage2_fair_critical_safe_v2_2_4obj,11,stage2_ext_013_obj_2,audit_shortlist,episode_002,6,6013,100,-170.59999424219131,-27.77499943971634,-18.80000028014183,0.0,False,False,True,5,,False,False,0,0,3,6,1,,47,0.47,0,0.0,0.46999809503555295,False,Tier 1 Near-Miss
ours_stage2_fair_critical_safe_v2_2_4obj,11,stage2_ext_013_obj_2,audit_shortlist,episode_002,7,7013,100,-170.59999424219131,-27.77499943971634,-18.80000028014183,0.0,False,False,True,5,,False,False,0,0,3,6,1,,47,0.47,0,0.0,0.4699979829788208,False,Tier 1 Near-Miss
ours_stage2_fair_critical_safe_v2_2_4obj,11,stage2_ext_013_obj_2,audit_shortlist,episode_003,0,14,100,-170.59999424219131,-27.77499943971634,-18.80000028014183,0.0,False,False,True,5,,False,False,0,0,3,6,1,,47,0.47,0,0.0,0.4699979829788208,False,Tier 1 Near-Miss
ours_stage2_fair_critical_safe_v2_2_4obj,11,stage2_ext_013_obj_2,audit_shortlist,episode_003,1,1014,100,-170.59999424219131,-27.77499943971634,-18.80000028014183,0.0,False,False,True,5,,False,False,0,0,3,6,1,,47,0.47,0,0.0,0.4699979829788208,False,Tier 1 Near-Miss
ours_stage2_fair_critical_safe_v2_2_4obj,11,stage2_ext_013_obj_2,audit_shortlist,episode_003,2,2014,100,-170.59999424219131,-27.77499943971634,-18.80000028014183,0.0,False,False,True,5,,False,False,0,0,3,6,1,,47,0.47,0,0.0,0.46999809503555295,False,Tier 1 Near-Miss
ours_stage2_fair_critical_safe_v2_2_4obj,11,stage2_ext_013_obj_2,audit_shortlist,episode_003,3,3014,100,-170.59999424219131,-27.77499943971634,-18.80000028014183,0.0,False,False,True,5,,False,False,0,0,3,6,1,,47,0.47,0,0.0,0.4699979829788208,False,Tier 1 Near-Miss
ours_stage2_fair_critical_safe_v2_2_4obj,11,stage2_ext_013_obj_2,audit_shortlist,episode_003,4,4014,100,-170.59999424219131,-27.77499943971634,-18.80000028014183,0.0,False,False,True,5,,False,False,0,0,3,6,1,,47,0.47,0,0.0,0.4699979829788208,False,Tier 1 Near-Miss
ours_stage2_fair_critical_safe_v2_2_4obj,11,stage2_ext_013_obj_2,audit_shortlist,episode_003,5,5014,100,-170.59999424219131,-27.77499943971634,-18.80000028014183,0.0,False,False,True,5,,False,False,0,0,3,6,1,,47,0.47,0,0.0,0.4699979829788208,False,Tier 1 Near-Miss
ours_stage2_fair_critical_safe_v2_2_4obj,11,stage2_ext_013_obj_2,audit_shortlist,episode_003,6,6014,100,-170.59999424219131,-27.77499943971634,-18.80000028014183,0.0,False,False,True,5,,False,False,0,0,3,6,1,,47,0.47,0,0.0,0.4699979829788208,False,Tier 1 Near-Miss
ours_stage2_fair_critical_safe_v2_2_4obj,11,stage2_ext_013_obj_2,audit_shortlist,episode_003,7,7014,100,-170.59999424219131,-27.77499943971634,-18.80000028014183,0.0,False,False,True,5,,False,False,0,0,3,6,1,,47,0.47,0,0.0,0.46999809503555295,False,Tier 1 Near-Miss
ours_stage2_fair_critical_safe_v2_2_4obj,11,stage2_ext_013_obj_2,audit_shortlist,episode_004,0,15,100,-170.59999424219131,-27.77499943971634,-18.80000028014183,0.0,False,False,True,5,,False,False,0,0,3,6,1,,47,0.47,0,0.0,0.46999809503555295,False,Tier 1 Near-Miss
ours_stage2_fair_critical_safe_v2_2_4obj,11,stage2_ext_013_obj_2,audit_shortlist,episode_004,1,1015,100,-170.59999424219131,-27.77499943971634,-18.80000028014183,0.0,False,False,True,5,,False,False,0,0,3,6,1,,47,0.47,0,0.0,0.46999809503555295,False,Tier 1 Near-Miss
ours_stage2_fair_critical_safe_v2_2_4obj,11,stage2_ext_013_obj_2,audit_shortlist,episode_004,2,2015,100,-170.59999424219131,-27.77499943971634,-18.80000028014183,0.0,False,False,True,5,,False,False,0,0,3,6,1,,47,0.47,0,0.0,0.4699979829788208,False,Tier 1 Near-Miss
ours_stage2_fair_critical_safe_v2_2_4obj,11,stage2_ext_013_obj_2,audit_shortlist,episode_004,3,3015,100,-170.59999424219131,-27.77499943971634,-18.80000028014183,0.0,False,False,True,5,,False,False,0,0,3,6,1,,47,0.47,0,0.0,0.4699979829788208,False,Tier 1 Near-Miss
ours_stage2_fair_critical_safe_v2_2_4obj,11,stage2_ext_013_obj_2,audit_shortlist,episode_004,4,4015,100,-170.59999424219131,-27.77499943971634,-18.80000028014183,0.0,False,False,True,5,,False,False,0,0,3,6,1,,47,0.47,0,0.0,0.46999809503555295,False,Tier 1 Near-Miss
ours_stage2_fair_critical_safe_v2_2_4obj,11,stage2_ext_013_obj_2,audit_shortlist,episode_004,5,5015,100,-170.59999424219131,-27.77499943971634,-18.80000028014183,0.0,False,False,True,5,,False,False,0,0,3,6,1,,47,0.47,0,0.0,0.4699979829788208,False,Tier 1 Near-Miss
ours_stage2_fair_critical_safe_v2_2_4obj,11,stage2_ext_013_obj_2,audit_shortlist,episode_004,6,6015,100,-170.59999424219131,-27.77499943971634,-18.80000028014183,0.0,False,False,True,5,,False,False,0,0,3,6,1,,47,0.47,0,0.0,0.4699979829788208,False,Tier 1 Near-Miss
ours_stage2_fair_critical_safe_v2_2_4obj,11,stage2_ext_013_obj_2,audit_shortlist,episode_004,7,7015,100,-170.59999424219131,-27.77499943971634,-18.80000028014183,0.0,False,False,True,5,,False,False,0,0,3,6,1,,47,0.47,0,0.0,0.4699979829788208,False,Tier 1 Near-Miss
ours_stage2_fair_critical_safe_v2_2_4obj,11,stage2_ext_013_obj_2,audit_shortlist,episode_005,0,16,100,-170.59999424219131,-27.77499943971634,-18.80000028014183,0.0,False,False,True,5,,False,False,0,0,3,6,1,,47,0.47,0,0.0,0.4699979829788208,False,Tier 1 Near-Miss
ours_stage2_fair_critical_safe_v2_2_4obj,11,stage2_ext_013_obj_2,audit_shortlist,episode_005,1,1016,100,-170.59999424219131,-27.77499943971634,-18.80000028014183,0.0,False,False,True,5,,False,False,0,0,3,6,1,,47,0.47,0,0.0,0.46999809503555295,False,Tier 1 Near-Miss
ours_stage2_fair_critical_safe_v2_2_4obj,11,stage2_ext_013_obj_2,audit_shortlist,episode_005,2,2016,100,-170.59999424219131,-27.824999451637268,-19.000000283122063,0.0,False,False,True,5,,False,False,0,0,3,6,1,,47,0.47,0,0.0,0.46999809503555295,False,Tier 1 Near-Miss
ours_stage2_fair_critical_safe_v2_2_4obj,11,stage2_ext_013_obj_2,audit_shortlist,episode_005,3,3016,100,-170.59999424219131,-27.77499943971634,-18.80000028014183,0.0,False,False,True,5,,False,False,0,0,3,6,1,,47,0.47,0,0.0,0.46999809503555295,False,Tier 1 Near-Miss
ours_stage2_fair_critical_safe_v2_2_4obj,11,stage2_ext_013_obj_2,audit_shortlist,episode_005,4,4016,100,-170.59999424219131,-27.77499943971634,-18.80000028014183,0.0,False,False,True,5,,False,False,0,0,3,6,1,,47,0.47,0,0.0,0.4699979829788208,False,Tier 1 Near-Miss
ours_stage2_fair_critical_safe_v2_2_4obj,11,stage2_ext_013_obj_2,audit_shortlist,episode_005,5,5016,100,-170.59999424219131,-27.77499943971634,-18.80000028014183,0.0,False,False,True,5,,False,False,0,0,3,6,1,,47,0.47,0,0.0,0.46999809503555295,False,Tier 1 Near-Miss
ours_stage2_fair_critical_safe_v2_2_4obj,11,stage2_ext_013_obj_2,audit_shortlist,episode_005,6,6016,100,-170.59999424219131,-27.77499943971634,-18.80000028014183,0.0,False,False,True,5,,False,False,0,0,3,6,1,,47,0.47,0,0.0,0.4699979829788208,False,Tier 1 Near-Miss
ours_stage2_fair_critical_safe_v2_2_4obj,11,stage2_ext_013_obj_2,audit_shortlist,episode_005,7,7016,100,-170.59999424219131,-27.77499943971634,-18.80000028014183,0.0,False,False,True,5,,False,False,0,0,3,6,1,,47,0.47,0,0.0,0.46999809503555295,False,Tier 1 Near-Miss
ours_stage2_fair_critical_safe_v2_2_4obj,11,stage2_ext_013_obj_2,audit_shortlist,episode_006,0,17,100,-170.59999424219131,-27.77499943971634,-18.80000028014183,0.0,False,False,True,5,,False,False,0,0,3,6,1,,47,0.47,0,0.0,0.46999809503555295,False,Tier 1 Near-Miss
ours_stage2_fair_critical_safe_v2_2_4obj,11,stage2_ext_013_obj_2,audit_shortlist,episode_006,1,1017,100,-170.59999424219131,-27.914999455213547,-19.000000283122063,0.0,False,False,True,5,,False,False,0,0,3,6,1,,47,0.47,0,0.0,0.46999809503555295,False,Tier 1 Near-Miss
ours_stage2_fair_critical_safe_v2_2_4obj,11,stage2_ext_013_obj_2,audit_shortlist,episode_006,2,2017,100,-170.59999424219131,-27.77499943971634,-18.80000028014183,0.0,False,False,True,5,,False,False,0,0,3,6,1,,47,0.47,0,0.0,0.4699979829788208,False,Tier 1 Near-Miss
ours_stage2_fair_critical_safe_v2_2_4obj,11,stage2_ext_013_obj_2,audit_shortlist,episode_006,3,3017,100,-170.59999424219131,-27.77499943971634,-18.80000028014183,0.0,False,False,True,5,,False,False,0,0,3,6,1,,47,0.47,0,0.0,0.46999809503555295,False,Tier 1 Near-Miss
ours_stage2_fair_critical_safe_v2_2_4obj,11,stage2_ext_013_obj_2,audit_shortlist,episode_006,4,4017,100,-170.59999424219131,-27.77499943971634,-18.80000028014183,0.0,False,False,True,5,,False,False,0,0,3,6,1,,47,0.47,0,0.0,0.46999809503555295,False,Tier 1 Near-Miss
ours_stage2_fair_critical_safe_v2_2_4obj,11,stage2_ext_013_obj_2,audit_shortlist,episode_006,5,5017,100,-170.59999424219131,-27.77499943971634,-18.80000028014183,0.0,False,False,True,5,,False,False,0,0,3,6,1,,47,0.47,0,0.0,0.4699979829788208,False,Tier 1 Near-Miss
ours_stage2_fair_critical_safe_v2_2_4obj,11,stage2_ext_013_obj_2,audit_shortlist,episode_006,6,6017,100,-170.59999424219131,-27.77499943971634,-18.80000028014183,0.0,False,False,True,5,,False,False,0,0,3,6,1,,47,0.47,0,0.0,0.46999809503555295,False,Tier 1 Near-Miss
ours_stage2_fair_critical_safe_v2_2_4obj,11,stage2_ext_013_obj_2,audit_shortlist,episode_006,7,7017,100,-170.59999424219131,-27.77499943971634,-18.80000028014183,0.0,False,False,True,5,,False,False,0,0,3,6,1,,47,0.47,0,0.0,0.46999809503555295,False,Tier 1 Near-Miss
ours_stage2_fair_critical_safe_v2_2_4obj,11,stage2_ext_013_obj_2,audit_shortlist,episode_007,0,18,100,-170.59999424219131,-27.77499943971634,-18.80000028014183,0.0,False,False,True,5,,False,False,0,0,3,6,1,,47,0.47,0,0.0,0.46999809503555295,False,Tier 1 Near-Miss
ours_stage2_fair_critical_safe_v2_2_4obj,11,stage2_ext_013_obj_2,audit_shortlist,episode_007,1,1018,100,-170.59999424219131,-27.77499943971634,-18.80000028014183,0.0,False,False,True,5,,False,False,0,0,3,6,1,,47,0.47,0,0.0,0.46999809503555295,False,Tier 1 Near-Miss
ours_stage2_fair_critical_safe_v2_2_4obj,11,stage2_ext_013_obj_2,audit_shortlist,episode_007,2,2018,100,-170.59999424219131,-27.77499943971634,-18.80000028014183,0.0,False,False,True,5,,False,False,0,0,3,6,1,,47,0.47,0,0.0,0.4699979829788208,False,Tier 1 Near-Miss
ours_stage2_fair_critical_safe_v2_2_4obj,11,stage2_ext_013_obj_2,audit_shortlist,episode_007,3,3018,100,-170.59999424219131,-27.77499943971634,-18.80000028014183,0.0,False,False,True,5,,False,False,0,0,3,6,1,,47,0.47,0,0.0,0.46999809503555295,False,Tier 1 Near-Miss
ours_stage2_fair_critical_safe_v2_2_4obj,11,stage2_ext_013_obj_2,audit_shortlist,episode_007,4,4018,100,-170.59999424219131,-27.77499943971634,-18.80000028014183,0.0,False,False,True,5,,False,False,0,0,3,6,1,,47,0.47,0,0.0,0.4699979829788208,False,Tier 1 Near-Miss
ours_stage2_fair_critical_safe_v2_2_4obj,11,stage2_ext_013_obj_2,audit_shortlist,episode_007,5,5018,100,-170.59999424219131,-27.77499943971634,-18.80000028014183,0.0,False,False,True,5,,False,False,0,0,3,6,1,,47,0.47,0,0.0,0.4699979829788208,False,Tier 1 Near-Miss
ours_stage2_fair_critical_safe_v2_2_4obj,11,stage2_ext_013_obj_2,audit_shortlist,episode_007,6,6018,100,-170.59999424219131,-27.77499943971634,-18.80000028014183,0.0,False,False,True,5,,False,False,0,0,3,6,1,,47,0.47,0,0.0,0.4699979829788208,False,Tier 1 Near-Miss
ours_stage2_fair_critical_safe_v2_2_4obj,11,stage2_ext_013_obj_2,audit_shortlist,episode_007,7,7018,100,-170.59999424219131,-27.77499943971634,-18.80000028014183,0.0,False,False,True,5,,False,False,0,0,3,6,1,,47,0.47,0,0.0,0.4699979829788208,False,Tier 1 Near-Miss
ours_stage2_fair_critical_safe_v2_2_4obj,11,stage2_ext_013_obj_2,audit_shortlist,episode_008,0,19,100,-170.59999424219131,-27.77499943971634,-18.80000028014183,0.0,False,False,True,5,,False,False,0,0,3,6,1,,47,0.47,0,0.0,0.4699979829788208,False,Tier 1 Near-Miss
ours_stage2_fair_critical_safe_v2_2_4obj,11,stage2_ext_013_obj_2,audit_shortlist,episode_008,1,1019,100,-170.59999424219131,-27.77499943971634,-18.80000028014183,0.0,False,False,True,5,,False,False,0,0,3,6,1,,47,0.47,0,0.0,0.46999809503555295,False,Tier 1 Near-Miss
ours_stage2_fair_critical_safe_v2_2_4obj,11,stage2_ext_013_obj_2,audit_shortlist,episode_008,2,2019,100,-170.59999424219131,-27.77499943971634,-18.80000028014183,0.0,False,False,True,5,,False,False,0,0,3,6,1,,47,0.47,0,0.0,0.46999809503555295,False,Tier 1 Near-Miss
ours_stage2_fair_critical_safe_v2_2_4obj,11,stage2_ext_013_obj_2,audit_shortlist,episode_008,3,3019,100,-170.59999424219131,-27.77499943971634,-18.80000028014183,0.0,False,False,True,5,,False,False,0,0,3,6,1,,47,0.47,0,0.0,0.4699979829788208,False,Tier 1 Near-Miss
ours_stage2_fair_critical_safe_v2_2_4obj,11,stage2_ext_013_obj_2,audit_shortlist,episode_008,4,4019,100,-170.59999424219131,-27.77499943971634,-18.80000028014183,0.0,False,False,True,5,,False,False,0,0,3,6,1,,47,0.47,0,0.0,0.46999809503555295,False,Tier 1 Near-Miss
ours_stage2_fair_critical_safe_v2_2_4obj,11,stage2_ext_013_obj_2,audit_shortlist,episode_008,5,5019,100,-170.59999424219131,-27.77499943971634,-18.80000028014183,0.0,False,False,True,5,,False,False,0,0,3,6,1,,47,0.47,0,0.0,0.4699979829788208,False,Tier 1 Near-Miss
ours_stage2_fair_critical_safe_v2_2_4obj,11,stage2_ext_013_obj_2,audit_shortlist,episode_008,6,6019,100,-170.59999424219131,-27.77499943971634,-18.80000028014183,0.0,False,False,True,5,,False,False,0,0,3,6,1,,47,0.47,0,0.0,0.46999809503555295,False,Tier 1 Near-Miss
ours_stage2_fair_critical_safe_v2_2_4obj,11,stage2_ext_013_obj_2,audit_shortlist,episode_008,7,7019,100,-170.59999424219131,-27.77499943971634,-18.80000028014183,0.0,False,False,True,5,,False,False,0,0,3,6,1,,47,0.47,0,0.0,0.46999809503555295,False,Tier 1 Near-Miss
ours_stage2_fair_critical_safe_v2_2_4obj,11,stage2_ext_013_obj_2,audit_shortlist,episode_009,0,20,100,-170.59999424219131,-27.77499943971634,-18.80000028014183,0.0,False,False,True,5,,False,False,0,0,3,6,1,,47,0.47,0,0.0,0.4699979829788208,False,Tier 1 Near-Miss
ours_stage2_fair_critical_safe_v2_2_4obj,11,stage2_ext_013_obj_2,audit_shortlist,episode_009,1,1020,100,-170.59999424219131,-27.77499943971634,-18.80000028014183,0.0,False,False,True,5,,False,False,0,0,3,6,1,,47,0.47,0,0.0,0.46999809503555295,False,Tier 1 Near-Miss
ours_stage2_fair_critical_safe_v2_2_4obj,11,stage2_ext_013_obj_2,audit_shortlist,episode_009,2,2020,100,-170.59999424219131,-27.77499943971634,-18.80000028014183,0.0,False,False,True,5,,False,False,0,0,3,6,1,,47,0.47,0,0.0,0.46999809503555295,False,Tier 1 Near-Miss
ours_stage2_fair_critical_safe_v2_2_4obj,11,stage2_ext_013_obj_2,audit_shortlist,episode_009,3,3020,100,-170.59999424219131,-27.77499943971634,-18.80000028014183,0.0,False,False,True,5,,False,False,0,0,3,6,1,,47,0.47,0,0.0,0.4699979829788208,False,Tier 1 Near-Miss
ours_stage2_fair_critical_safe_v2_2_4obj,11,stage2_ext_013_obj_2,audit_shortlist,episode_009,4,4020,100,-170.59999424219131,-27.77499943971634,-18.80000028014183,0.0,False,False,True,5,,False,False,0,0,3,6,1,,47,0.47,0,0.0,0.4699979829788208,False,Tier 1 Near-Miss
ours_stage2_fair_critical_safe_v2_2_4obj,11,stage2_ext_013_obj_2,audit_shortlist,episode_009,5,5020,100,-170.59999424219131,-27.77499943971634,-18.80000028014183,0.0,False,False,True,5,,False,False,0,0,3,6,1,,47,0.47,0,0.0,0.4699979829788208,False,Tier 1 Near-Miss
ours_stage2_fair_critical_safe_v2_2_4obj,11,stage2_ext_013_obj_2,audit_shortlist,episode_009,6,6020,100,-170.59999424219131,-27.77499943971634,-18.80000028014183,0.0,False,False,True,5,,False,False,0,0,3,6,1,,47,0.47,0,0.0,0.4699979829788208,False,Tier 1 Near-Miss
ours_stage2_fair_critical_safe_v2_2_4obj,11,stage2_ext_013_obj_2,audit_shortlist,episode_009,7,7020,100,-170.59999424219131,-27.77499943971634,-18.80000028014183,0.0,False,False,True,5,,False,False,0,0,3,6,1,,47,0.47,0,0.0,0.46999809503555295,False,Tier 1 Near-Miss

cmorl_cyborg/outputs/archive/2026-04-21_second_phase/paper_appendix/critical_safe_v2_4_4obj_analysis/pilot/seed_0011/audit_selected__stage2_ext_005_obj_1_semantic_audit_replay20/critical_casebook.md

## Worst Security Return

- Basic info: `episode_id=episode_000` `env_idx=0` `env_seed=11` `risk_tier=Tier 1 Near-Miss`
- Returns: `security=-170.6000` `business=-27.7750` `cost=-18.8000`
- Key times: `enterprise_foothold_step=5` `first_critical_hit_step=None` `first_relevant_blue_response=6`

## Max Critical Dwell

- Basic info: `episode_id=episode_001` `env_idx=0` `env_seed=12` `risk_tier=Tier 1 Near-Miss`
- Returns: `security=-170.6000` `business=-27.8250` `cost=-19.0000`
- Key times: `enterprise_foothold_step=5` `first_critical_hit_step=None` `first_relevant_blue_response=6`