cmorl_cyborg/outputs/archive/2026-04-21_second_phase/paper_appendix/critical_safe_v2_4_4obj_analysis/audit_shortlist/seed_0019/audit_shortlist__stage2_ext_009_obj_1_semantic_audit_replay20/env_run_risk_table.csv

method_name,seed,policy_id,candidate_label,episode_id,env_idx,env_seed,step_count,security_return,business_return,cost_return,critical_host_safety_return,business_violation_flag,cost_violation_flag,env_run_feasible_flag,enterprise_foothold_step,first_critical_hit_step,ever_critical_breach,final_critical_breach,critical_dwell_steps,op_server0_impact_count,max_compromised_host_count,blue_first_relevant_response_step,response_delay_after_enterprise,response_delay_after_critical,shield_active_step_count,shield_active_step_rate,shield_fallback_step_count,shield_fallback_step_rate,mean_shield_blocked_probability_mass,no_post_critical_response,risk_tier
ours_stage2_fair_critical_safe_v2_4_4obj,19,stage2_ext_009_obj_1,audit_shortlist,episode_000,0,19,100,-170.59999424219131,-27.77499943971634,-19.860000256448984,0.0,False,False,True,5,,False,False,0,0,3,6,1,,47,0.47,0,0.0,0.46999901950359346,False,Tier 1 Near-Miss
ours_stage2_fair_critical_safe_v2_4_4obj,19,stage2_ext_009_obj_1,audit_shortlist,episode_000,1,1019,100,-170.59999424219131,-27.77499943971634,-19.860000256448984,0.0,False,False,True,5,,False,False,0,0,3,6,1,,47,0.47,0,0.0,0.4699996918439865,False,Tier 1 Near-Miss
ours_stage2_fair_critical_safe_v2_4_4obj,19,stage2_ext_009_obj_1,audit_shortlist,episode_000,2,2019,100,-170.59999424219131,-27.77499943971634,-19.860000256448984,0.0,False,False,True,5,,False,False,0,0,3,6,1,,47,0.47,0,0.0,0.4699996918439865,False,Tier 1 Near-Miss
ours_stage2_fair_critical_safe_v2_4_4obj,19,stage2_ext_009_obj_1,audit_shortlist,episode_000,3,3019,100,-170.59999424219131,-27.77499943971634,-19.860000256448984,0.0,False,False,True,5,,False,False,0,0,3,6,1,,47,0.47,0,0.0,0.46999901950359346,False,Tier 1 Near-Miss
ours_stage2_fair_critical_safe_v2_4_4obj,19,stage2_ext_009_obj_1,audit_shortlist,episode_000,4,4019,100,-170.59999424219131,-27.77499943971634,-19.860000256448984,0.0,False,False,True,5,,False,False,0,0,3,6,1,,47,0.47,0,0.0,0.4699996918439865,False,Tier 1 Near-Miss
ours_stage2_fair_critical_safe_v2_4_4obj,19,stage2_ext_009_obj_1,audit_shortlist,episode_000,5,5019,100,-170.59999424219131,-27.77499943971634,-19.860000256448984,0.0,False,False,True,5,,False,False,0,0,3,6,1,,47,0.47,0,0.0,0.46999901950359346,False,Tier 1 Near-Miss
ours_stage2_fair_critical_safe_v2_4_4obj,19,stage2_ext_009_obj_1,audit_shortlist,episode_000,6,6019,100,-170.59999424219131,-27.77499943971634,-19.860000256448984,0.0,False,False,True,5,,False,False,0,0,3,6,1,,47,0.47,0,0.0,0.4699996918439865,False,Tier 1 Near-Miss
ours_stage2_fair_critical_safe_v2_4_4obj,19,stage2_ext_009_obj_1,audit_shortlist,episode_000,7,7019,100,-170.59999424219131,-27.77499943971634,-19.860000256448984,0.0,False,False,True,5,,False,False,0,0,3,6,1,,47,0.47,0,0.0,0.4699996918439865,False,Tier 1 Near-Miss
ours_stage2_fair_critical_safe_v2_4_4obj,19,stage2_ext_009_obj_1,audit_shortlist,episode_001,0,20,100,-170.59999424219131,-27.77499943971634,-19.860000256448984,0.0,False,False,True,5,,False,False,0,0,3,6,1,,47,0.47,0,0.0,0.46999901950359346,False,Tier 1 Near-Miss
ours_stage2_fair_critical_safe_v2_4_4obj,19,stage2_ext_009_obj_1,audit_shortlist,episode_001,1,1020,100,-170.59999424219131,-27.77499943971634,-19.860000256448984,0.0,False,False,True,5,,False,False,0,0,3,6,1,,47,0.47,0,0.0,0.4699996918439865,False,Tier 1 Near-Miss
ours_stage2_fair_critical_safe_v2_4_4obj,19,stage2_ext_009_obj_1,audit_shortlist,episode_001,2,2020,100,-170.59999424219131,-27.77499943971634,-19.860000256448984,0.0,False,False,True,5,,False,False,0,0,3,6,1,,47,0.47,0,0.0,0.4699996918439865,False,Tier 1 Near-Miss
ours_stage2_fair_critical_safe_v2_4_4obj,19,stage2_ext_009_obj_1,audit_shortlist,episode_001,3,3020,100,-170.59999424219131,-27.77499943971634,-19.860000256448984,0.0,False,False,True,5,,False,False,0,0,3,6,1,,47,0.47,0,0.0,0.46999901950359346,False,Tier 1 Near-Miss
ours_stage2_fair_critical_safe_v2_4_4obj,19,stage2_ext_009_obj_1,audit_shortlist,episode_001,4,4020,100,-170.59999424219131,-27.77499943971634,-19.860000256448984,0.0,False,False,True,5,,False,False,0,0,3,6,1,,47,0.47,0,0.0,0.46999901950359346,False,Tier 1 Near-Miss
ours_stage2_fair_critical_safe_v2_4_4obj,19,stage2_ext_009_obj_1,audit_shortlist,episode_001,5,5020,100,-170.59999424219131,-27.77499943971634,-19.860000256448984,0.0,False,False,True,5,,False,False,0,0,3,6,1,,47,0.47,0,0.0,0.46999901950359346,False,Tier 1 Near-Miss
ours_stage2_fair_critical_safe_v2_4_4obj,19,stage2_ext_009_obj_1,audit_shortlist,episode_001,6,6020,100,-170.59999424219131,-27.77499943971634,-19.860000256448984,0.0,False,False,True,5,,False,False,0,0,3,6,1,,47,0.47,0,0.0,0.46999901950359346,False,Tier 1 Near-Miss
ours_stage2_fair_critical_safe_v2_4_4obj,19,stage2_ext_009_obj_1,audit_shortlist,episode_001,7,7020,100,-170.59999424219131,-27.77499943971634,-19.860000256448984,0.0,False,False,True,5,,False,False,0,0,3,6,1,,47,0.47,0,0.0,0.4699996918439865,False,Tier 1 Near-Miss
ours_stage2_fair_critical_safe_v2_4_4obj,19,stage2_ext_009_obj_1,audit_shortlist,episode_002,0,21,100,-170.59999424219131,-27.77499943971634,-19.860000256448984,0.0,False,False,True,5,,False,False,0,0,3,6,1,,47,0.47,0,0.0,0.4699996918439865,False,Tier 1 Near-Miss
ours_stage2_fair_critical_safe_v2_4_4obj,19,stage2_ext_009_obj_1,audit_shortlist,episode_002,1,1021,100,-170.59999424219131,-27.77499943971634,-19.860000256448984,0.0,False,False,True,5,,False,False,0,0,3,6,1,,47,0.47,0,0.0,0.46999901950359346,False,Tier 1 Near-Miss
ours_stage2_fair_critical_safe_v2_4_4obj,19,stage2_ext_009_obj_1,audit_shortlist,episode_002,2,2021,100,-170.59999424219131,-27.77499943971634,-19.860000256448984,0.0,False,False,True,5,,False,False,0,0,3,6,1,,47,0.47,0,0.0,0.4699996918439865,False,Tier 1 Near-Miss
ours_stage2_fair_critical_safe_v2_4_4obj,19,stage2_ext_009_obj_1,audit_shortlist,episode_002,3,3021,100,-170.59999424219131,-27.77499943971634,-19.860000256448984,0.0,False,False,True,5,,False,False,0,0,3,6,1,,47,0.47,0,0.0,0.4699996918439865,False,Tier 1 Near-Miss
ours_stage2_fair_critical_safe_v2_4_4obj,19,stage2_ext_009_obj_1,audit_shortlist,episode_002,4,4021,100,-170.59999424219131,-27.77499943971634,-19.860000256448984,0.0,False,False,True,5,,False,False,0,0,3,6,1,,47,0.47,0,0.0,0.46999901950359346,False,Tier 1 Near-Miss
ours_stage2_fair_critical_safe_v2_4_4obj,19,stage2_ext_009_obj_1,audit_shortlist,episode_002,5,5021,100,-170.59999424219131,-27.77499943971634,-19.860000256448984,0.0,False,False,True,5,,False,False,0,0,3,6,1,,47,0.47,0,0.0,0.4699996918439865,False,Tier 1 Near-Miss
ours_stage2_fair_critical_safe_v2_4_4obj,19,stage2_ext_009_obj_1,audit_shortlist,episode_002,6,6021,100,-170.59999424219131,-27.77499943971634,-19.860000256448984,0.0,False,False,True,5,,False,False,0,0,3,6,1,,47,0.47,0,0.0,0.46999901950359346,False,Tier 1 Near-Miss
ours_stage2_fair_critical_safe_v2_4_4obj,19,stage2_ext_009_obj_1,audit_shortlist,episode_002,7,7021,100,-170.59999424219131,-27.77499943971634,-19.860000256448984,0.0,False,False,True,5,,False,False,0,0,3,6,1,,47,0.47,0,0.0,0.46999901950359346,False,Tier 1 Near-Miss
ours_stage2_fair_critical_safe_v2_4_4obj,19,stage2_ext_009_obj_1,audit_shortlist,episode_003,0,22,100,-170.59999424219131,-27.77499943971634,-19.860000256448984,0.0,False,False,True,5,,False,False,0,0,3,6,1,,47,0.47,0,0.0,0.4699996918439865,False,Tier 1 Near-Miss
ours_stage2_fair_critical_safe_v2_4_4obj,19,stage2_ext_009_obj_1,audit_shortlist,episode_003,1,1022,100,-170.59999424219131,-27.77499943971634,-19.860000256448984,0.0,False,False,True,5,,False,False,0,0,3,6,1,,47,0.47,0,0.0,0.4699996918439865,False,Tier 1 Near-Miss
ours_stage2_fair_critical_safe_v2_4_4obj,19,stage2_ext_009_obj_1,audit_shortlist,episode_003,2,2022,100,-170.59999424219131,-27.77499943971634,-19.860000256448984,0.0,False,False,True,5,,False,False,0,0,3,6,1,,47,0.47,0,0.0,0.46999901950359346,False,Tier 1 Near-Miss
ours_stage2_fair_critical_safe_v2_4_4obj,19,stage2_ext_009_obj_1,audit_shortlist,episode_003,3,3022,100,-170.59999424219131,-27.77499943971634,-19.860000256448984,0.0,False,False,True,5,,False,False,0,0,3,6,1,,47,0.47,0,0.0,0.4699996918439865,False,Tier 1 Near-Miss
ours_stage2_fair_critical_safe_v2_4_4obj,19,stage2_ext_009_obj_1,audit_shortlist,episode_003,4,4022,100,-170.59999424219131,-27.77499943971634,-19.860000256448984,0.0,False,False,True,5,,False,False,0,0,3,6,1,,47,0.47,0,0.0,0.46999901950359346,False,Tier 1 Near-Miss
ours_stage2_fair_critical_safe_v2_4_4obj,19,stage2_ext_009_obj_1,audit_shortlist,episode_003,5,5022,100,-170.59999424219131,-27.77499943971634,-19.860000256448984,0.0,False,False,True,5,,False,False,0,0,3,6,1,,47,0.47,0,0.0,0.4699996918439865,False,Tier 1 Near-Miss
ours_stage2_fair_critical_safe_v2_4_4obj,19,stage2_ext_009_obj_1,audit_shortlist,episode_003,6,6022,100,-170.59999424219131,-27.77499943971634,-19.860000256448984,0.0,False,False,True,5,,False,False,0,0,3,6,1,,47,0.47,0,0.0,0.4699996918439865,False,Tier 1 Near-Miss
ours_stage2_fair_critical_safe_v2_4_4obj,19,stage2_ext_009_obj_1,audit_shortlist,episode_003,7,7022,100,-170.59999424219131,-27.77499943971634,-19.860000256448984,0.0,False,False,True,5,,False,False,0,0,3,6,1,,47,0.47,0,0.0,0.46999901950359346,False,Tier 1 Near-Miss
ours_stage2_fair_critical_safe_v2_4_4obj,19,stage2_ext_009_obj_1,audit_shortlist,episode_004,0,23,100,-170.59999424219131,-27.77499943971634,-19.860000256448984,0.0,False,False,True,5,,False,False,0,0,3,6,1,,47,0.47,0,0.0,0.4699996918439865,False,Tier 1 Near-Miss
ours_stage2_fair_critical_safe_v2_4_4obj,19,stage2_ext_009_obj_1,audit_shortlist,episode_004,1,1023,100,-170.59999424219131,-27.77499943971634,-19.860000256448984,0.0,False,False,True,5,,False,False,0,0,3,6,1,,47,0.47,0,0.0,0.4699996918439865,False,Tier 1 Near-Miss
ours_stage2_fair_critical_safe_v2_4_4obj,19,stage2_ext_009_obj_1,audit_shortlist,episode_004,2,2023,100,-170.59999424219131,-27.77499943971634,-19.860000256448984,0.0,False,False,True,5,,False,False,0,0,3,6,1,,47,0.47,0,0.0,0.46999901950359346,False,Tier 1 Near-Miss
ours_stage2_fair_critical_safe_v2_4_4obj,19,stage2_ext_009_obj_1,audit_shortlist,episode_004,3,3023,100,-170.59999424219131,-27.77499943971634,-19.860000256448984,0.0,False,False,True,5,,False,False,0,0,3,6,1,,47,0.47,0,0.0,0.4699996918439865,False,Tier 1 Near-Miss
ours_stage2_fair_critical_safe_v2_4_4obj,19,stage2_ext_009_obj_1,audit_shortlist,episode_004,4,4023,100,-170.59999424219131,-27.79249945282936,-20.09000025689602,0.0,False,False,True,5,,False,False,0,0,3,6,1,,47,0.47,0,0.0,0.46999901950359346,False,Tier 1 Near-Miss
ours_stage2_fair_critical_safe_v2_4_4obj,19,stage2_ext_009_obj_1,audit_shortlist,episode_004,5,5023,100,-170.59999424219131,-27.77499943971634,-19.860000256448984,0.0,False,False,True,5,,False,False,0,0,3,6,1,,47,0.47,0,0.0,0.4699996918439865,False,Tier 1 Near-Miss
ours_stage2_fair_critical_safe_v2_4_4obj,19,stage2_ext_009_obj_1,audit_shortlist,episode_004,6,6023,100,-170.59999424219131,-27.77499943971634,-19.860000256448984,0.0,False,False,True,5,,False,False,0,0,3,6,1,,47,0.47,0,0.0,0.46999901950359346,False,Tier 1 Near-Miss
ours_stage2_fair_critical_safe_v2_4_4obj,19,stage2_ext_009_obj_1,audit_shortlist,episode_004,7,7023,100,-170.59999424219131,-27.77499943971634,-19.860000256448984,0.0,False,False,True,5,,False,False,0,0,3,6,1,,47,0.47,0,0.0,0.46999901950359346,False,Tier 1 Near-Miss
ours_stage2_fair_critical_safe_v2_4_4obj,19,stage2_ext_009_obj_1,audit_shortlist,episode_005,0,24,100,-170.59999424219131,-27.77499943971634,-19.860000256448984,0.0,False,False,True,5,,False,False,0,0,3,6,1,,47,0.47,0,0.0,0.4699996918439865,False,Tier 1 Near-Miss
ours_stage2_fair_critical_safe_v2_4_4obj,19,stage2_ext_009_obj_1,audit_shortlist,episode_005,1,1024,100,-170.59999424219131,-27.77499943971634,-19.860000256448984,0.0,False,False,True,5,,False,False,0,0,3,6,1,,47,0.47,0,0.0,0.4699996918439865,False,Tier 1 Near-Miss
ours_stage2_fair_critical_safe_v2_4_4obj,19,stage2_ext_009_obj_1,audit_shortlist,episode_005,2,2024,100,-170.59999424219131,-27.77499943971634,-19.860000256448984,0.0,False,False,True,5,,False,False,0,0,3,6,1,,47,0.47,0,0.0,0.4699996918439865,False,Tier 1 Near-Miss
ours_stage2_fair_critical_safe_v2_4_4obj,19,stage2_ext_009_obj_1,audit_shortlist,episode_005,3,3024,100,-170.59999424219131,-27.77499943971634,-19.860000256448984,0.0,False,False,True,5,,False,False,0,0,3,6,1,,47,0.47,0,0.0,0.46999901950359346,False,Tier 1 Near-Miss
ours_stage2_fair_critical_safe_v2_4_4obj,19,stage2_ext_009_obj_1,audit_shortlist,episode_005,4,4024,100,-170.59999424219131,-27.77499943971634,-19.860000256448984,0.0,False,False,True,5,,False,False,0,0,3,6,1,,47,0.47,0,0.0,0.4699996918439865,False,Tier 1 Near-Miss
ours_stage2_fair_critical_safe_v2_4_4obj,19,stage2_ext_009_obj_1,audit_shortlist,episode_005,5,5024,100,-170.59999424219131,-27.77499943971634,-19.860000256448984,0.0,False,False,True,5,,False,False,0,0,3,6,1,,47,0.47,0,0.0,0.4699996918439865,False,Tier 1 Near-Miss
ours_stage2_fair_critical_safe_v2_4_4obj,19,stage2_ext_009_obj_1,audit_shortlist,episode_005,6,6024,100,-170.59999424219131,-27.77499943971634,-19.860000256448984,0.0,False,False,True,5,,False,False,0,0,3,6,1,,47,0.47,0,0.0,0.46999901950359346,False,Tier 1 Near-Miss
ours_stage2_fair_critical_safe_v2_4_4obj,19,stage2_ext_009_obj_1,audit_shortlist,episode_005,7,7024,100,-170.59999424219131,-27.77499943971634,-19.860000256448984,0.0,False,False,True,5,,False,False,0,0,3,6,1,,47,0.47,0,0.0,0.4699996918439865,False,Tier 1 Near-Miss
ours_stage2_fair_critical_safe_v2_4_4obj,19,stage2_ext_009_obj_1,audit_shortlist,episode_006,0,25,100,-170.59999424219131,-27.77499943971634,-19.860000256448984,0.0,False,False,True,5,,False,False,0,0,3,6,1,,47,0.47,0,0.0,0.46999901950359346,False,Tier 1 Near-Miss
ours_stage2_fair_critical_safe_v2_4_4obj,19,stage2_ext_009_obj_1,audit_shortlist,episode_006,1,1025,100,-170.59999424219131,-27.77499943971634,-19.860000256448984,0.0,False,False,True,5,,False,False,0,0,3,6,1,,47,0.47,0,0.0,0.46999901950359346,False,Tier 1 Near-Miss
ours_stage2_fair_critical_safe_v2_4_4obj,19,stage2_ext_009_obj_1,audit_shortlist,episode_006,2,2025,100,-170.59999424219131,-27.77499943971634,-19.860000256448984,0.0,False,False,True,5,,False,False,0,0,3,6,1,,47,0.47,0,0.0,0.46999901950359346,False,Tier 1 Near-Miss
ours_stage2_fair_critical_safe_v2_4_4obj,19,stage2_ext_009_obj_1,audit_shortlist,episode_006,3,3025,100,-170.59999424219131,-27.77499943971634,-19.860000256448984,0.0,False,False,True,5,,False,False,0,0,3,6,1,,47,0.47,0,0.0,0.46999901950359346,False,Tier 1 Near-Miss
ours_stage2_fair_critical_safe_v2_4_4obj,19,stage2_ext_009_obj_1,audit_shortlist,episode_006,4,4025,100,-170.59999424219131,-27.77499943971634,-19.860000256448984,0.0,False,False,True,5,,False,False,0,0,3,6,1,,47,0.47,0,0.0,0.46999901950359346,False,Tier 1 Near-Miss
ours_stage2_fair_critical_safe_v2_4_4obj,19,stage2_ext_009_obj_1,audit_shortlist,episode_006,5,5025,100,-170.59999424219131,-27.77499943971634,-19.860000256448984,0.0,False,False,True,5,,False,False,0,0,3,6,1,,47,0.47,0,0.0,0.46999901950359346,False,Tier 1 Near-Miss
ours_stage2_fair_critical_safe_v2_4_4obj,19,stage2_ext_009_obj_1,audit_shortlist,episode_006,6,6025,100,-170.59999424219131,-27.77499943971634,-19.860000256448984,0.0,False,False,True,5,,False,False,0,0,3,6,1,,47,0.47,0,0.0,0.46999901950359346,False,Tier 1 Near-Miss
ours_stage2_fair_critical_safe_v2_4_4obj,19,stage2_ext_009_obj_1,audit_shortlist,episode_006,7,7025,100,-170.59999424219131,-27.77499943971634,-19.860000256448984,0.0,False,False,True,5,,False,False,0,0,3,6,1,,47,0.47,0,0.0,0.4699996918439865,False,Tier 1 Near-Miss
ours_stage2_fair_critical_safe_v2_4_4obj,19,stage2_ext_009_obj_1,audit_shortlist,episode_007,0,26,100,-170.59999424219131,-27.77499943971634,-19.860000256448984,0.0,False,False,True,5,,False,False,0,0,3,6,1,,47,0.47,0,0.0,0.46999901950359346,False,Tier 1 Near-Miss
ours_stage2_fair_critical_safe_v2_4_4obj,19,stage2_ext_009_obj_1,audit_shortlist,episode_007,1,1026,100,-170.59999424219131,-27.77499943971634,-19.860000256448984,0.0,False,False,True,5,,False,False,0,0,3,6,1,,47,0.47,0,0.0,0.4699996918439865,False,Tier 1 Near-Miss
ours_stage2_fair_critical_safe_v2_4_4obj,19,stage2_ext_009_obj_1,audit_shortlist,episode_007,2,2026,100,-170.59999424219131,-27.77499943971634,-19.860000256448984,0.0,False,False,True,5,,False,False,0,0,3,6,1,,47,0.47,0,0.0,0.4699996918439865,False,Tier 1 Near-Miss
ours_stage2_fair_critical_safe_v2_4_4obj,19,stage2_ext_009_obj_1,audit_shortlist,episode_007,3,3026,100,-170.59999424219131,-27.77499943971634,-19.860000256448984,0.0,False,False,True,5,,False,False,0,0,3,6,1,,47,0.47,0,0.0,0.46999901950359346,False,Tier 1 Near-Miss
ours_stage2_fair_critical_safe_v2_4_4obj,19,stage2_ext_009_obj_1,audit_shortlist,episode_007,4,4026,100,-170.59999424219131,-27.77499943971634,-19.860000256448984,0.0,False,False,True,5,,False,False,0,0,3,6,1,,47,0.47,0,0.0,0.46999901950359346,False,Tier 1 Near-Miss
ours_stage2_fair_critical_safe_v2_4_4obj,19,stage2_ext_009_obj_1,audit_shortlist,episode_007,5,5026,100,-170.59999424219131,-27.77499943971634,-19.860000256448984,0.0,False,False,True,5,,False,False,0,0,3,6,1,,47,0.47,0,0.0,0.46999901950359346,False,Tier 1 Near-Miss
ours_stage2_fair_critical_safe_v2_4_4obj,19,stage2_ext_009_obj_1,audit_shortlist,episode_007,6,6026,100,-170.59999424219131,-27.77499943971634,-19.860000256448984,0.0,False,False,True,5,,False,False,0,0,3,6,1,,47,0.47,0,0.0,0.4699996918439865,False,Tier 1 Near-Miss
ours_stage2_fair_critical_safe_v2_4_4obj,19,stage2_ext_009_obj_1,audit_shortlist,episode_007,7,7026,100,-170.59999424219131,-27.77499943971634,-19.860000256448984,0.0,False,False,True,5,,False,False,0,0,3,6,1,,47,0.47,0,0.0,0.46999901950359346,False,Tier 1 Near-Miss
ours_stage2_fair_critical_safe_v2_4_4obj,19,stage2_ext_009_obj_1,audit_shortlist,episode_008,0,27,100,-170.59999424219131,-27.77499943971634,-19.860000256448984,0.0,False,False,True,5,,False,False,0,0,3,6,1,,47,0.47,0,0.0,0.4699996918439865,False,Tier 1 Near-Miss
ours_stage2_fair_critical_safe_v2_4_4obj,19,stage2_ext_009_obj_1,audit_shortlist,episode_008,1,1027,100,-170.59999424219131,-27.77499943971634,-19.860000256448984,0.0,False,False,True,5,,False,False,0,0,3,6,1,,47,0.47,0,0.0,0.4699996918439865,False,Tier 1 Near-Miss
ours_stage2_fair_critical_safe_v2_4_4obj,19,stage2_ext_009_obj_1,audit_shortlist,episode_008,2,2027,100,-170.59999424219131,-27.77499943971634,-19.860000256448984,0.0,False,False,True,5,,False,False,0,0,3,6,1,,47,0.47,0,0.0,0.4699996918439865,False,Tier 1 Near-Miss
ours_stage2_fair_critical_safe_v2_4_4obj,19,stage2_ext_009_obj_1,audit_shortlist,episode_008,3,3027,100,-170.59999424219131,-27.77499943971634,-19.860000256448984,0.0,False,False,True,5,,False,False,0,0,3,6,1,,47,0.47,0,0.0,0.4699996918439865,False,Tier 1 Near-Miss
ours_stage2_fair_critical_safe_v2_4_4obj,19,stage2_ext_009_obj_1,audit_shortlist,episode_008,4,4027,100,-170.59999424219131,-27.77499943971634,-19.860000256448984,0.0,False,False,True,5,,False,False,0,0,3,6,1,,47,0.47,0,0.0,0.4699996918439865,False,Tier 1 Near-Miss
ours_stage2_fair_critical_safe_v2_4_4obj,19,stage2_ext_009_obj_1,audit_shortlist,episode_008,5,5027,100,-170.59999424219131,-27.77499943971634,-19.860000256448984,0.0,False,False,True,5,,False,False,0,0,3,6,1,,47,0.47,0,0.0,0.4699996918439865,False,Tier 1 Near-Miss
ours_stage2_fair_critical_safe_v2_4_4obj,19,stage2_ext_009_obj_1,audit_shortlist,episode_008,6,6027,100,-170.59999424219131,-27.77499943971634,-19.860000256448984,0.0,False,False,True,5,,False,False,0,0,3,6,1,,47,0.47,0,0.0,0.46999901950359346,False,Tier 1 Near-Miss
ours_stage2_fair_critical_safe_v2_4_4obj,19,stage2_ext_009_obj_1,audit_shortlist,episode_008,7,7027,100,-170.59999424219131,-27.77499943971634,-19.860000256448984,0.0,False,False,True,5,,False,False,0,0,3,6,1,,47,0.47,0,0.0,0.4699996918439865,False,Tier 1 Near-Miss
ours_stage2_fair_critical_safe_v2_4_4obj,19,stage2_ext_009_obj_1,audit_shortlist,episode_009,0,28,100,-170.59999424219131,-27.77499943971634,-19.860000256448984,0.0,False,False,True,5,,False,False,0,0,3,6,1,,47,0.47,0,0.0,0.4699996918439865,False,Tier 1 Near-Miss
ours_stage2_fair_critical_safe_v2_4_4obj,19,stage2_ext_009_obj_1,audit_shortlist,episode_009,1,1028,100,-170.59999424219131,-27.77499943971634,-19.860000256448984,0.0,False,False,True,5,,False,False,0,0,3,6,1,,47,0.47,0,0.0,0.46999901950359346,False,Tier 1 Near-Miss
ours_stage2_fair_critical_safe_v2_4_4obj,19,stage2_ext_009_obj_1,audit_shortlist,episode_009,2,2028,100,-170.59999424219131,-27.77499943971634,-19.860000256448984,0.0,False,False,True,5,,False,False,0,0,3,6,1,,47,0.47,0,0.0,0.46999901950359346,False,Tier 1 Near-Miss
ours_stage2_fair_critical_safe_v2_4_4obj,19,stage2_ext_009_obj_1,audit_shortlist,episode_009,3,3028,100,-170.59999424219131,-27.77499943971634,-19.860000256448984,0.0,False,False,True,5,,False,False,0,0,3,6,1,,47,0.47,0,0.0,0.4699996918439865,False,Tier 1 Near-Miss
ours_stage2_fair_critical_safe_v2_4_4obj,19,stage2_ext_009_obj_1,audit_shortlist,episode_009,4,4028,100,-170.59999424219131,-27.77499943971634,-19.860000256448984,0.0,False,False,True,5,,False,False,0,0,3,6,1,,47,0.47,0,0.0,0.4699996918439865,False,Tier 1 Near-Miss
ours_stage2_fair_critical_safe_v2_4_4obj,19,stage2_ext_009_obj_1,audit_shortlist,episode_009,5,5028,100,-170.59999424219131,-27.77499943971634,-19.860000256448984,0.0,False,False,True,5,,False,False,0,0,3,6,1,,47,0.47,0,0.0,0.46999901950359346,False,Tier 1 Near-Miss
ours_stage2_fair_critical_safe_v2_4_4obj,19,stage2_ext_009_obj_1,audit_shortlist,episode_009,6,6028,100,-170.59999424219131,-27.77499943971634,-19.860000256448984,0.0,False,False,True,5,,False,False,0,0,3,6,1,,47,0.47,0,0.0,0.46999901950359346,False,Tier 1 Near-Miss
ours_stage2_fair_critical_safe_v2_4_4obj,19,stage2_ext_009_obj_1,audit_shortlist,episode_009,7,7028,100,-170.59999424219131,-27.77499943971634,-19.860000256448984,0.0,False,False,True,5,,False,False,0,0,3,6,1,,47,0.47,0,0.0,0.46999901950359346,False,Tier 1 Near-Miss

cmorl_cyborg/outputs/archive/2026-04-21_second_phase/paper_appendix/critical_safe_v2_4_4obj_analysis/audit_shortlist/seed_0019/audit_shortlist__stage2_ext_010_obj_2_semantic_audit_replay20/critical_casebook.md

## Worst Business Return

- Basic info: `episode_id=episode_004` `env_idx=4` `env_seed=4023` `risk_tier=Tier 1 Near-Miss`
- Returns: `security=-170.6000` `business=-27.7925` `cost=-20.0900`
- Key times: `enterprise_foothold_step=5` `first_critical_hit_step=None` `first_relevant_blue_response=6`

## Worst Security Return

- Basic info: `episode_id=episode_000` `env_idx=0` `env_seed=19` `risk_tier=Tier 1 Near-Miss`
- Returns: `security=-170.6000` `business=-27.7750` `cost=-19.8600`
- Key times: `enterprise_foothold_step=5` `first_critical_hit_step=None` `first_relevant_blue_response=6`

## Max Critical Dwell

- Basic info: `episode_id=episode_001` `env_idx=0` `env_seed=20` `risk_tier=Tier 1 Near-Miss`
- Returns: `security=-170.6000` `business=-27.7750` `cost=-19.8600`
- Key times: `enterprise_foothold_step=5` `first_critical_hit_step=None` `first_relevant_blue_response=6`